来源,所属区域,文章标题,发布日期,详情链接
SolarQuarter,南亚,Top Stories Of The Day: India Strengthens Grid for 500 GW Clean Power; Solex 3.78 GW Module Plant Added to ALMM and More…,2026-03-10,https://solarquarter.com/2026/03/10/top-stories-of-the-day-india-strengthens-grid-for-500-gw-clean-power-solex-3-78-gw-module-plant-added-to-almm-and-more/
SolarQuarter,全球/其他,"FTC Solar Announces 1,000MW Expansion to Tracker Supply Agreement with Strata Clean Energy",2026-03-10,https://solarquarter.com/2026/03/10/ftc-solar-announces-1000mw-expansion-to-tracker-supply-agreement-with-strata-clean-energy/
SolarQuarter,北非及中东,INJAZ Bahrain Headquarters Becomes First Youth Center In MENA To Achieve LEED Gold Certification,2026-03-10,https://solarquarter.com/2026/03/10/injaz-bahrain-headquarters-becomes-first-youth-center-in-mena-to-achieve-leed-gold-certification/
SolarQuarter,南欧,NORD/LB Completes Financing For 75 MW Solar Portfolio Spanning 21 Projects Across Italy,2026-03-10,https://solarquarter.com/2026/03/10/nord-lb-completes-financing-for-75-mw-solar-portfolio-spanning-21-projects-across-italy/
SolarQuarter,全球/其他,Hinen Brings Latest Residential And Commercial Storage Systems To Johannesburg Expo Centre From 25–27 March 2026,2026-03-10,https://solarquarter.com/2026/03/10/hinen-brings-latest-residential-and-commercial-storage-systems-to-johannesburg-expo-centre-from-25-27-march-2026/
SolarQuarter,东亚,Hyundai Motor Group To Invest KRW 9 Trillion In Hydrogen And Solar Innovation Hub In South Korea,2026-03-10,https://solarquarter.com/2026/03/10/hyundai-motor-group-to-invest-krw-9-trillion-in-hydrogen-and-solar-innovation-hub-in-south-korea/
SolarQuarter,东南亚,ACEN To Invest $268 Million In 2 GWh Battery Storage For San Marcelino Solar Park In Philippines,2026-03-10,https://solarquarter.com/2026/03/10/acen-to-invest-268-million-in-2-gwh-battery-storage-for-san-marcelino-solar-park-in-philippines/
SolarQuarter,全球/其他,Trianel Energieprojekte GmbH & Co. KG Sells 70.4 MWp Brandenburg Solar Park To Nuveen European Core Renewable Infrastructure Strategy,2026-03-10,https://solarquarter.com/2026/03/10/trianel-energieprojekte-gmbh-co-kg-sells-70-4-mwp-brandenburg-solar-park-to-nuveen-european-core-renewable-infrastructure-strategy/
SolarQuarter,北非及中东,Tunisia Invites Bids for 300 MW Solar Project with 150 MW/540 MWh Battery Storage in Kebili,2026-03-10,https://solarquarter.com/2026/03/10/tunisia-invites-bids-for-300-mw-solar-project-with-150-mw-540-mwh-battery-storage-in-kebili/
SolarQuarter,非洲南部,Copperbelt Energy Corporation Expands Solar Capacity To 230 MW As Zambia Accelerates Renewable Energy Transition,2026-03-10,https://solarquarter.com/2026/03/10/copperbelt-energy-corporation-expands-solar-capacity-to-230-mw-as-zambia-accelerates-renewable-energy-transition/
SolarQuarter,全球/其他,"Yindjibarndi Energy Corporation Opens EOI For Industrial Buyers Seeking Large-Scale Clean Power, In Partnership With ACEN Corporation",2026-03-10,https://solarquarter.com/2026/03/10/yindjibarndi-energy-corporation-opens-eoi-for-industrial-buyers-seeking-large-scale-clean-power-in-partnership-with-acen-corporation/
SolarQuarter,非洲南部,South Africa Joins Global Pledge To Triple Nuclear Energy Capacity By 2050,2026-03-10,https://solarquarter.com/2026/03/10/south-africa-joins-global-pledge-to-triple-nuclear-energy-capacity-by-2050/
SolarQuarter,北非及中东,Sahaj Solar Board Approves UAE Subsidiary to Develop 750 MW Solar Manufacturing Facility,2026-03-10,https://solarquarter.com/2026/03/10/sahaj-solar-board-approves-uae-subsidiary-to-develop-750-mw-solar-manufacturing-facility/
SolarQuarter,全球/其他,Rising Demand For Owner’s Engineer Services Drives Smarter Renewable Energy Project Development Across Africa,2026-03-10,https://solarquarter.com/2026/03/10/rising-demand-for-owners-engineer-services-drives-smarter-renewable-energy-project-development-across-africa/
SolarQuarter,全球/其他,Hero Future Energies Honoured For Its Green Hydrogen Breakthrough Backed By The Ministry Of Electronics And Information Technology,2026-03-10,https://solarquarter.com/2026/03/10/hero-future-energies-honoured-for-its-green-hydrogen-breakthrough-backed-by-the-ministry-of-electronics-and-information-technology/
SolarQuarter,全球/其他,"Assam Electricity Regulatory Commission Keeps Power Tariffs Unchanged For FY 2026–27, Offers Relief To Consumers",2026-03-10,https://solarquarter.com/2026/03/10/assam-electricity-regulatory-commission-keeps-power-tariffs-unchanged-for-fy-2026-27-offers-relief-to-consumers/
SolarQuarter,全球/其他,GERC Partially Approves Torrent Power’s Bidding Deviations For 200 MW Renewable Energy Tender,2026-03-10,https://solarquarter.com/2026/03/10/gerc-partially-approves-torrent-powers-bidding-deviations-for-200-mw-renewable-energy-tender/
SolarQuarter,全球/其他,Solex Energy’s 3.78 GW Surat Solar Module Plant Added to MNRE’s ALMM List,2026-03-10,https://solarquarter.com/2026/03/10/solex-energys-3-78-gw-surat-solar-module-plant-added-to-mnres-almm-list/
SolarQuarter,全球/其他,Andhra Pradesh Introduces Resource Adequacy Regulations 2026 To Strengthen Power Planning And Grid Reliability,2026-03-10,https://solarquarter.com/2026/03/10/andhra-pradesh-introduces-resource-adequacy-regulations-2026-to-strengthen-power-planning-and-grid-reliability/
SolarQuarter,全球/其他,Clean Max Enviro Energy Solutions Sells Entire Stake In Clean Max Hana To TCPL Packaging,2026-03-10,https://solarquarter.com/2026/03/10/clean-max-enviro-energy-solutions-sells-entire-stake-in-clean-max-hana-to-tcpl-packaging/
SolarQuarter,全球/其他,KPI Green Energy Commissions Additional 24.2 MW Capacity In 250 MW Solar Project Awarded By GUVNL,2026-03-10,https://solarquarter.com/2026/03/10/kpi-green-energy-commissions-additional-24-2-mw-capacity-in-250-mw-solar-project-awarded-by-guvnl/
SolarQuarter,南亚,Gautam Solar Breaks Into India’s Top 4 Solar Module Manufacturers,2026-03-10,https://solarquarter.com/2026/03/10/gautam-solar-breaks-into-indias-top-4-solar-module-manufacturers/
SolarQuarter,南亚,India’s Floating Solar Sector Gets Major Push As TrueRE Oriana Power Secures 234 MW Project From Damodar Valley Corporation In Jharkhand,2026-03-10,https://solarquarter.com/2026/03/10/indias-floating-solar-sector-gets-major-push-as-truere-oriana-power-secures-234-mw-project-from-damodar-valley-corporation-in-jharkhand/
SolarQuarter,北非及中东,"Sahaj Solar To Set Up 750 MW Solar Panel Manufacturing Plant In UAE, Shifts Expansion Strategy Overseas",2026-03-10,https://solarquarter.com/2026/03/10/sahaj-solar-to-set-up-750-mw-solar-panel-manufacturing-plant-in-uae-shifts-expansion-strategy-overseas/
SolarQuarter,全球/其他,Trinasolar Tops BNEF Bankability Rating for the Eighth Time,2026-03-10,https://solarquarter.com/2026/03/10/trinasolar-tops-bnef-bankability-rating-for-the-eighth-time/
SolarQuarter,全球/其他,"Torrent Power Limited Raises ₹2,000 Crore Through NCD Issue To Strengthen Long-Term Funding Strategy",2026-03-10,https://solarquarter.com/2026/03/10/torrent-power-limited-raises-%e2%82%b92000-crore-through-ncd-issue-to-strengthen-long-term-funding-strategy/
SolarQuarter,东南亚,Founder Group Secures RM16 Million Deal To Build Large-Scale Solar Plant Under Malaysia’s Corporate Green Power Programme,2026-03-10,https://solarquarter.com/2026/03/10/founder-group-secures-rm16-million-deal-to-build-large-scale-solar-plant-under-malaysias-corporate-green-power-programme/
SolarQuarter,全球/其他,"ACME Solar Secures ₹2,300 Crore Long-Term Financing From NaBFID To Expand Renewable Energy Projects",2026-03-10,https://solarquarter.com/2026/03/10/acme-solar-secures-%e2%82%b92300-crore-long-term-financing-from-nabfid-to-expand-renewable-energy-projects/
SolarQuarter,全球/其他,NTPC Green Energy Commissions 91.6 MW Solar Project In Andhra Pradesh,2026-03-10,https://solarquarter.com/2026/03/10/ntpc-green-energy-commissions-91-6-mw-solar-project-in-andhra-pradesh/
SolarQuarter,全球/其他,Global LDES Installations Cross 15 GWh in 2025 as Lithium-Ion Battery Economics Reshape Energy Storage Landscape,2026-03-10,https://solarquarter.com/2026/03/10/global-ldes-installations-cross-15-gwh-in-2025-as-lithium-ion-battery-economics-reshape-energy-storage-landscape/
SolarQuarter,东非,"POWERGRID Approves ₹5,000 Crore Loan, Substation Security Investment And Uganda Transmission Partnership",2026-03-10,https://solarquarter.com/2026/03/10/powergrid-approves-%e2%82%b95000-crore-loan-substation-security-investment-and-uganda-transmission-partnership/
SolarQuarter,北非及中东,SLG Delivers Green Hydrogen Systems for ACME Group’s Green Ammonia Project in Oman,2026-03-10,https://solarquarter.com/2026/03/10/slg-delivers-green-hydrogen-systems-for-acme-groups-green-ammonia-project-in-oman/
SolarQuarter,非洲南部,"Lyra Energy Secures Financial Close for 255-MW Thakadu Solar Project, Signalling Momentum in South Africa’s Private Renewable Market",2026-03-10,https://solarquarter.com/2026/03/10/lyra-energy-secures-financial-close-for-255-mw-thakadu-solar-project-signalling-momentum-in-south-africas-private-renewable-market/
SolarQuarter,全球/其他,SECI Invites Top AMCs To Manage Surplus Funds Through Liquid And Overnight Investment Schemes For FY2026,2026-03-10,https://solarquarter.com/2026/03/10/seci-invites-top-amcs-to-manage-surplus-funds-through-liquid-and-overnight-investment-schemes-for-fy2026/
SolarQuarter,东南亚,Equator Renewables Asia Raises S$50 Million to Advance Solar and Green Hydrogen Projects in Indonesia,2026-03-10,https://solarquarter.com/2026/03/10/equator-renewables-asia-raises-s50-million-to-advance-solar-and-green-hydrogen-projects-in-indonesia/
SolarQuarter,全球/其他,"CATL Reports Strong Growth in 2025, Strengthens Global Leadership in Battery and Energy Storage Markets",2026-03-10,https://solarquarter.com/2026/03/10/catl-reports-strong-growth-in-2025-strengthens-global-leadership-in-battery-and-energy-storage-markets/
SolarQuarter,全球/其他,"Global Media Spotlight JA Solar’s DeepBlue 5.0, Redefining the Future of High‑Value Solar",2026-03-10,https://solarquarter.com/2026/03/10/global-media-spotlight-ja-solars-deepblue-5-0-redefining-the-future-of-high-value-solar/
SolarQuarter,东南亚,Frank Phuan’s Equator Renewables Asia Raises S$50 Million To Expand Solar And Green Hydrogen Projects In Indonesia,2026-03-10,https://solarquarter.com/2026/03/10/frank-phuans-equator-renewables-asia-raises-s50-million-to-expand-solar-and-green-hydrogen-projects-in-indonesia/
SolarQuarter,南亚,"TERI Unveils Research, Tools to Accelerate Agrivoltaics Deployment in India",2026-03-10,https://solarquarter.com/2026/03/10/teri-unveils-research-tools-to-accelerate-agrivoltaics-deployment-in-india/
SolarQuarter,跨区域,European Commission Approves €150 Million Romanian Scheme to Boost Electricity Storage,2026-03-10,https://solarquarter.com/2026/03/10/european-commission-approves-e150-million-romanian-scheme-to-boost-electricity-storage/
SolarQuarter,全球/其他,NHPC Advances Dulhasti Stage-II Hydro Project; DPR Approved and Environmental Clearance Secured,2026-03-10,https://solarquarter.com/2026/03/10/nhpc-advances-dulhasti-stage-ii-hydro-project-dpr-approved-and-environmental-clearance-secured/
SolarQuarter,南亚,India Strengthens Grid Infrastructure to Integrate Over 500 GW of Non-Fossil Capacity by 2030,2026-03-10,https://solarquarter.com/2026/03/10/india-strengthens-grid-infrastructure-to-integrate-over-500-gw-of-non-fossil-capacity-by-2030/
SolarQuarter,全球/其他,MSME Ministry Expands Support for Energy Efficiency and Green Transition in Small Enterprises,2026-03-10,https://solarquarter.com/2026/03/10/msme-ministry-expands-support-for-energy-efficiency-and-green-transition-in-small-enterprises/
Electrive,西欧,DKV Mobility offers Rheinmetall pavement charging solution in Germany,2026-03-10,https://www.electrive.com/2026/03/10/dkv-mobility-offers-rheinmetall-pavement-charging-solution-in-germany/
Electrive,东南亚,Malaysia: Tesla begins opening its charging network to other EVs,2026-03-10,https://www.electrive.com/2026/03/10/malaysia-tesla-begins-opening-its-charging-network-to-other-evs/
PowerTechnology,全球/其他,New episode: Sustainable reporting in mining,2026-03-10,https://www.power-technology.com/news/new-episode-sustainable-reporting-in-mining/
PowerTechnology,全球/其他,Nordex wins order for 40 turbines from wpd for German wind farms,2026-03-10,https://www.power-technology.com/news/nordex-order-wpd-german-wind-farms/
PowerTechnology,全球/其他,RGREENINVEST and Renalfa to establish renewables JV,2026-03-10,https://www.power-technology.com/news/rgreeninvest-renalfa-to-establish-jv/
PowerTechnology,全球/其他,GridStor secures $120m for Gunnar Reliability Project in Texas,2026-03-10,https://www.power-technology.com/news/gridstor-secures-120m-gunnar-reliability-project/
PowerTechnology,西欧,Fugro begins geotechnical survey of Oriel offshore wind farm in Ireland,2026-03-10,https://www.power-technology.com/news/fugro-begins-geotechnical-survey-oriel/
EnergyStorageNews,拉丁美洲,"Argentina launches 700MW/2,800MWh BESS tender",2026-03-10,https://www.energy-storage.news/argentina-launches-700mw-2800mwh-bess-tender/
EnergyStorageNews,全球/其他,"Long-duration tech still outcompeted by lithium, trade group advocates for ‘valuing diversity’",2026-03-10,https://www.energy-storage.news/long-duration-tech-still-outcompeted-by-lithium-trade-group-advocates-for-valuing-diversity/
EnergyStorageNews,全球/其他,Base Power launches 100MW VPP programme in Texas,2026-03-10,https://www.energy-storage.news/base-power-launches-100mw-vpp-programme-in-texas/
EnergyStorageNews,跨区域,"From software to shareholder: Flower, Volkswagen’s Elli and Nuvve launch Germany &  Sweden BESS projects",2026-03-10,https://www.energy-storage.news/from-software-to-shareholder-flower-volkswagens-elli-and-nuvve-launch-germany-sweden-bess-projects/
EnergyStorageNews,大洋洲,Octopus Australia breaks ground on 486MWh Blind Creek Solar Farm and Battery project,2026-03-10,https://www.energy-storage.news/octopus-australia-breaks-ground-on-486mwh-blind-creek-solar-farm-and-battery-project/
EnergyStorageNews,大洋洲,Australia: NSW planners approve 400MWh Burroway solar-plus-storage despite community objections,2026-03-10,https://www.energy-storage.news/australia-nsw-planners-approve-400mwh-burroway-solar-plus-storage-despite-community-objections/
PVMagazine,西欧,Wales first part of UK to mandate solar panels on new buildings,2026-03-10,https://www.pv-magazine.com/2026/03/10/wales-first-part-of-uk-to-mandate-solar-panels-on-new-buildings/
PVMagazine,全球/其他,VDE Americas upgrades hail risk model for utility-scale solar,2026-03-10,https://www.pv-magazine.com/2026/03/10/vde-americas-upgrades-hail-risk-model-for-utility-scale-solar/
PVMagazine,全球/其他,Hizenergy launches four-product C&I storage lineup with 300 kW PCS,2026-03-10,https://www.pv-magazine.com/2026/03/10/hizenergy-launches-four-product-ci-storage-lineup-with-300-kw-pcs/
PVMagazine,西欧,Volkswagen launches first large-scale battery storage project in Germany,2026-03-10,https://www.pv-magazine.com/2026/03/10/volkswagen-launches-first-large-scale-battery-storage-project-in-germany/
PVMagazine,西欧,Netherlands hits record electricity production and exports in 2025,2026-03-10,https://www.pv-magazine.com/2026/03/10/netherlands-hits-record-electricity-production-and-exports-in-2025/
PVMagazine,全球/其他,Gas-fired electricity two to three times costlier than renewable backups,2026-03-10,https://www.pv-magazine.com/2026/03/10/gas-fired-electricity-two-to-three-times-costlier-than-renewable-backups/
PVMagazine,全球/其他,Longi launches fire-resistant solar module for rooftop PV,2026-03-10,https://www.pv-magazine.com/2026/03/10/longi-launches-fire-resistant-solar-module-for-rooftop-pv/
PVMagazine,全球/其他,Financial sponsors increasingly back European battery storage platforms,2026-03-10,https://www.pv-magazine.com/2026/03/10/financial-sponsors-increasingly-back-european-battery-storage-platforms/
PVMagazine,全球/其他,Involtics unveils GTSI single-phase hybrid inverter for homes,2026-03-10,https://www.pv-magazine.com/2026/03/10/involtics-launches-gtsi-single-phase-hybrid-inverter-for-homes/
PVMagazine,全球/其他,TOPCon solar modules show self-healing under UV stress,2026-03-10,https://www.pv-magazine.com/2026/03/10/topcon-solar-modules-show-uv-induced-degradation-recovery-study-finds/
PVMagazine,大洋洲,"Australia fast-tracks solar ingot, wafer plant with ‘major project’ status",2026-03-10,https://www.pv-magazine.com/2026/03/10/australia-fast-tracks-solar-ingot-wafer-plant-with-major-project-status/
PVMagazine,全球/其他,First attempt to build solar modules using polycarbonate encapsulant,2026-03-10,https://www.pv-magazine.com/2026/03/10/first-attempt-to-build-solar-modules-using-polycarbonate-encapsulant/
PVMagazine,全球/其他,Chemical incidents halt Silfab Solar factory as US probe begins,2026-03-10,https://www.pv-magazine.com/2026/03/10/chemical-incidents-halt-silfab-solar-factory-as-us-probe-begins/
PVMagazine,全球/其他,Water-spray cooling can improve PV module efficiency by 28% in arid environments,2026-03-10,https://www.pv-magazine.com/2026/03/10/water-spray-cooling-can-improve-pv-module-efficiency-by-28-in-arid-environments/
